<?xml version="1.0"?>

<domain_h2d xmlns:xsi="http://www.w3.org/2001/XMLSchema-instance"
       xsi:noNamespaceSchemaLocation="subdomains_h2d_xml.xsd">

  <variables>
    <variable name="a" value="1.0" />
    <variable name="two_a" value="2.0" />
  </variables>

  <vertices>
    <vertex x="0" y="0" />
		<vertex x="a" y="0" />
		<vertex x="two_a" y="0" />
		<vertex x="two_a" y="a" />
		<vertex x="two_a" y="two_a" />
		<vertex x="a" y="two_a" />
		<vertex x="0" y="two_a" />
		<vertex x="0" y="a" />
		<vertex x="a" y="a" />
  </vertices>

  <elements>
		<quad v1="0" v2="1" v3="8" v4="7" marker="Bottom Left" />
		<quad v1="1" v2="2" v3="3" v4="8" marker="Bottom Right" />
		<quad v1="8" v2="3" v3="4" v4="5" marker="Top Right" />
		<quad v1="7" v2="8" v3="5" v4="6" marker="Top Left" />
  </elements>

  <boundaries>
    <boundary_edge v1="0" v2="1" marker="Bottom Left" />
		<boundary_edge v1="1" v2="2" marker="Bottom Right" />
		
		<boundary_edge v1="2" v2="3" marker="Bottom Right" />
		<boundary_edge v1="3" v2="4" marker="Top Right" />
		
		<boundary_edge v1="4" v2="5" marker="Top Right" />
		<boundary_edge v1="5" v2="6" marker="Top left" />
		
		<boundary_edge v1="6" v2="7" marker="Top Left" />
		<boundary_edge v1="7" v2="0" marker="BottomLeft" />
		
		<boundary_edge v1="1" v2="8" marker="Vertical Bottom" />
		<boundary_edge v1="8" v2="1" marker="Vertical Bottom" />
		<boundary_edge v1="8" v2="5" marker="Vertical Top" />
		<boundary_edge v1="5" v2="8" marker="Vertical Top" />
		
		<boundary_edge v1="7" v2="8" marker="Horizontal Left" />
		<boundary_edge v1="8" v2="7" marker="Horizontal Left" />
		<boundary_edge v1="8" v2="3" marker="Horizontal Right" />
		<boundary_edge v1="3" v2="8" marker="Horizontal Right" />
	</boundaries>
	
	<subdomains>
		<subdomain name="Whole domain" />
		<subdomain name="Bottom Left Corner" >
			<element-number number="0" />
			<boundary_edge-number number="0" />
			<boundary_edge-number number="8" />
			<boundary_edge-number number="13" />
			<boundary_edge-number number="7" />
		</subdomain>
		<subdomain name="Supplement of Bottom Left Corner">
			<element-number number="1" />
			<element-number number="2" />
			<element-number number="3" />
			<boundary_edge-number number="1" />
			<boundary_edge-number number="2" />
			<boundary_edge-number number="3" />
			<boundary_edge-number number="4" />
			<boundary_edge-number number="5" />
			<boundary_edge-number number="6" />
			<boundary_edge-number number="12" />
			<boundary_edge-number number="9" />
		</subdomain>
	</subdomains>
</domain_h2d>